{
  "Version": 1,
  "Id": "midnight",
  "Name": "Midnight",
  "Author": "",
  "Description": "Графітові поверхні, чіткі контури й м’ятний акцент.",
  "Material": "Solid",
  "FontName": "Segoe UI Variable Text",
  "CornerRadius": 6,
  "SurfaceOpacity": 1,
  "BorderWidth": 1.5,
  "StyleSheet": "/* Carbon: dense graphite, precise edges, floating accents. */\n.theme { skin: studio; }\n.bar { height: 40px; padding: 4px; gap: 2px; border-radius: 8px; border-width: 0px; }\n.tab { height: 32px; padding: 0px 14px; margin: 0px; border-radius: 6px; border-width: 0px; font-size: 12px; font-weight: semibold; indicator: rail; selected-background: accent-soft; }\n.menu { width: 280px; padding: 10px; gap: 2px; border-radius: 12px; border-width: 0px; box-shadow: 0px 8px 32px rgba(0,0,0,0.3); }\n.menu-item { height: 36px; padding: 0px 12px; margin: 0px; border-radius: 6px; border-width: 0px; icon-size: 20px; }\n.button { min-height: 32px; padding: 5px 14px; border-radius: 6px; border-width: 0px; font-size: 12px; font-weight: semibold; }\n.button-primary { background: var(--accent); box-shadow: 0px 3px 12px rgba(50,210,170,0.15); }\n.input { min-height: 32px; padding: 5px 12px; border-radius: 6px; border-width: 0px; }\n.card { padding: 18px 20px; gap: 10px; border-radius: 10px; border-width: 0px; overlay: linear-gradient(120deg, rgba(255,255,255,0.035), transparent); }\n.sidebar-item { height: 36px; padding: 0px 14px; margin: 2px 0px; border-radius: 6px; font-weight: semibold; }\n.window { border-radius: 0px; border-width: 1px; }\n.titlebar { height: 36px; border-width: 1px; }\n.sidebar { border-radius: 0px; border-width: 1px; }\n.page { background: transparent; border-width: 0px; }\n.toast { border-radius: 0px; border-width: 1px; }\n",
  "StyleSheetFile": "",
  "StyleResources": "<ResourceDictionary xmlns=\"http://schemas.microsoft.com/winfx/2006/xaml/presentation\" xmlns:x=\"http://schemas.microsoft.com/winfx/2006/xaml\" xmlns:fx=\"clr-namespace:CategoryBar.Theming;assembly=CategoryBar\">\n<ControlTemplate x:Key=\"Theme.WorkspaceTemplate\" TargetType=\"fx:ThemeSurface\">\n<Grid><Grid.ColumnDefinitions><ColumnDefinition Width=\"Auto\"/><ColumnDefinition/></Grid.ColumnDefinitions>\n<ContentControl Width=\"{DynamicResource Theme.Parameter.navigation-width}\" Style=\"{DynamicResource Theme.Sidebar}\" Margin=\"0\" Content=\"{TemplateBinding Header}\"/>\n<ContentControl Grid.Column=\"1\" Style=\"{DynamicResource Theme.Page}\" Content=\"{TemplateBinding Content}\"/><Border Grid.Column=\"1\" Width=\"1\" HorizontalAlignment=\"Left\" Background=\"{DynamicResource Theme.Parameter.rail-color}\" Visibility=\"{DynamicResource Theme.Parameter.show-rail.Visibility}\" IsHitTestVisible=\"False\"/>\n</Grid></ControlTemplate>\n<Style x:Key=\"Theme.NavigationPanel\" TargetType=\"StackPanel\"><Setter Property=\"Orientation\" Value=\"Vertical\"/><Setter Property=\"Margin\" Value=\"10,6,10,10\"/></Style>\n<Storyboard x:Key=\"Theme.Window.Enter\" FillBehavior=\"Stop\">\n<DoubleAnimation Storyboard.TargetProperty=\"Opacity\" From=\"0\" To=\"1\" Duration=\"0:0:0.1\"/>\n<DoubleAnimation Storyboard.TargetProperty=\"(UIElement.RenderTransform).(TranslateTransform.Y)\" From=\"0\" To=\"0\" Duration=\"0:0:0.1\"><DoubleAnimation.EasingFunction><CubicEase EasingMode=\"EaseOut\"/></DoubleAnimation.EasingFunction></DoubleAnimation>\n</Storyboard>\n<Storyboard x:Key=\"Theme.Page.Enter\" FillBehavior=\"Stop\">\n<DoubleAnimation Storyboard.TargetProperty=\"Opacity\" From=\"0\" To=\"1\" Duration=\"0:0:0.1\"/>\n<DoubleAnimation Storyboard.TargetProperty=\"(UIElement.RenderTransform).(TranslateTransform.Y)\" From=\"0\" To=\"0\" Duration=\"0:0:0.1\"><DoubleAnimation.EasingFunction><CubicEase EasingMode=\"EaseOut\"/></DoubleAnimation.EasingFunction></DoubleAnimation>\n</Storyboard>\n<Storyboard x:Key=\"Theme.Tab.Enter\" FillBehavior=\"Stop\">\n<DoubleAnimation Storyboard.TargetProperty=\"Opacity\" From=\"0\" To=\"1\" Duration=\"0:0:0.1\"/>\n<DoubleAnimation Storyboard.TargetProperty=\"(UIElement.RenderTransform).(TranslateTransform.Y)\" From=\"0\" To=\"0\" Duration=\"0:0:0.1\"><DoubleAnimation.EasingFunction><CubicEase EasingMode=\"EaseOut\"/></DoubleAnimation.EasingFunction></DoubleAnimation>\n</Storyboard>\n<Storyboard x:Key=\"Theme.Menu.Enter\" FillBehavior=\"Stop\">\n<DoubleAnimation Storyboard.TargetProperty=\"Opacity\" From=\"0\" To=\"1\" Duration=\"0:0:0.1\"/>\n<DoubleAnimation Storyboard.TargetProperty=\"(UIElement.RenderTransform).(TranslateTransform.Y)\" From=\"0\" To=\"0\" Duration=\"0:0:0.1\"><DoubleAnimation.EasingFunction><CubicEase EasingMode=\"EaseOut\"/></DoubleAnimation.EasingFunction></DoubleAnimation>\n</Storyboard>\n<Storyboard x:Key=\"Theme.Bar.Enter\" FillBehavior=\"Stop\">\n<DoubleAnimation Storyboard.TargetProperty=\"Opacity\" From=\"0\" To=\"1\" Duration=\"0:0:0.1\"/>\n<DoubleAnimation Storyboard.TargetProperty=\"(UIElement.RenderTransform).(TranslateTransform.Y)\" From=\"0\" To=\"0\" Duration=\"0:0:0.1\"><DoubleAnimation.EasingFunction><CubicEase EasingMode=\"EaseOut\"/></DoubleAnimation.EasingFunction></DoubleAnimation>\n</Storyboard>\n<Storyboard x:Key=\"Theme.Toast.Enter\" FillBehavior=\"Stop\">\n<DoubleAnimation Storyboard.TargetProperty=\"Opacity\" From=\"0\" To=\"1\" Duration=\"0:0:0.1\"/>\n<DoubleAnimation Storyboard.TargetProperty=\"(UIElement.RenderTransform).(TranslateTransform.Y)\" From=\"0\" To=\"0\" Duration=\"0:0:0.1\"><DoubleAnimation.EasingFunction><CubicEase EasingMode=\"EaseOut\"/></DoubleAnimation.EasingFunction></DoubleAnimation>\n</Storyboard>\n<Storyboard x:Key=\"Theme.Content.Enter\" FillBehavior=\"Stop\">\n<DoubleAnimation Storyboard.TargetProperty=\"Opacity\" From=\"0\" To=\"1\" Duration=\"0:0:0.1\"/>\n<DoubleAnimation Storyboard.TargetProperty=\"(UIElement.RenderTransform).(TranslateTransform.Y)\" From=\"0\" To=\"0\" Duration=\"0:0:0.1\"><DoubleAnimation.EasingFunction><CubicEase EasingMode=\"EaseOut\"/></DoubleAnimation.EasingFunction></DoubleAnimation>\n</Storyboard>\n<Storyboard x:Key=\"Theme.Menu.Exit\" FillBehavior=\"HoldEnd\"><DoubleAnimation Storyboard.TargetProperty=\"Opacity\" To=\"0\" Duration=\"0:0:0.10\"/><DoubleAnimation Storyboard.TargetProperty=\"(UIElement.RenderTransform).(TranslateTransform.Y)\" To=\"4\" Duration=\"0:0:0.10\"/></Storyboard>\n<Storyboard x:Key=\"Theme.Menu.Switch\" FillBehavior=\"Stop\"><DoubleAnimation Storyboard.TargetProperty=\"Opacity\" From=\"0.35\" To=\"1\" Duration=\"0:0:0.14\"/></Storyboard>\n</ResourceDictionary>\n",
  "StyleResourcesFile": "",
  "Shaders": {},
  "ShaderFiles": {},
  "Dark": {
    "Bar.Bg": "#191F24",
    "Menu.Bg": "#171D22",
    "Popup.Bg": "#222A31",
    "Window.Bg": "#101519",
    "Sidebar.Bg": "#151B20",
    "Card.Bg": "#1B2329",
    "Control.Bg": "#232D35",
    "Text": "#EEF5F6",
    "Text.Muted": "#ADBFC5",
    "Text.Faint": "#9AACB5",
    "Surface.Border": "#455762",
    "Accent": "#73E3C0"
  },
  "Light": {
    "Bar.Bg": "#E6EEEF",
    "Menu.Bg": "#F5F9F9",
    "Popup.Bg": "#FFFFFF",
    "Window.Bg": "#EDF3F3",
    "Sidebar.Bg": "#E0EAEA",
    "Card.Bg": "#FFFFFF",
    "Control.Bg": "#F8FBFB",
    "Text": "#172C2C",
    "Text.Muted": "#435F60",
    "Text.Faint": "#536D6E",
    "Surface.Border": "#A0B7B8",
    "Accent": "#006B51"
  },
  "Backdrop": "None",
  "Parameters": [
    {
      "Id": "navigation-width",
      "Label": "Ширина навігації",
      "Type": "Number",
      "Default": "186",
      "Minimum": 160,
      "Maximum": 260,
      "Step": 2
    },
    {
      "Id": "show-rail",
      "Label": "Акцентна лінія",
      "Type": "Toggle",
      "Default": "true"
    },
    {
      "Id": "rail-color",
      "Label": "Колір лінії",
      "Type": "Color",
      "Default": "#455762"
    }
  ]
}
