{
  "Version": 1,
  "Id": "expressive",
  "Name": "Expressive",
  "Author": "",
  "Description": "Виразні бузкові тони й округлі кольорові поверхні.",
  "Material": "Solid",
  "FontName": "Segoe UI Variable Text",
  "CornerRadius": 16,
  "SurfaceOpacity": 1,
  "BorderWidth": 1,
  "StyleSheet": "/* Large tonal surfaces with pill actions and deliberate whitespace. */\n.theme { skin: studio; }\n.bar { height: 52px; padding: 6px; gap: 6px; border-radius: 28px; border-width: 0px; }\n.tab { height: 40px; padding: 0px 22px; margin: 0px; border-radius: 24px; border-width: 0px; font-size: 14px; font-weight: bold; indicator: none; selected-background: accent-soft; }\n.menu { width: 314px; padding: 14px; gap: 6px; border-radius: 28px; border-width: 0px; box-shadow: 0px 8px 28px rgba(0,0,0,0.18); }\n.menu-item { height: 46px; padding: 0px 16px; margin: 0px; border-radius: 22px; border-width: 0px; icon-size: 30px; }\n.button { min-height: 40px; padding: 8px 24px; border-radius: 28px; border-width: 0px; font-size: 14px; font-weight: bold; }\n.input { min-height: 40px; padding: 8px 16px; border-radius: 18px; border-width: 0px; background: var(--accent-soft); }\n.card { padding: 24px; gap: 16px; border-radius: 28px; border-width: 0px; }\n.sidebar-item { height: 44px; padding: 0px 18px; margin: 3px 0px; border-radius: 24px; font-weight: semibold; }\n.window { border-radius: 16px; border-width: 0px; }\n.titlebar { height: 44px; background: transparent; border-width: 0px; }\n.sidebar { border-radius: 24px; border-width: 0px; }\n.page { background: transparent; border-width: 0px; }\n.toast { border-radius: 28px; border-width: 0px; }\n",
  "StyleSheetFile": "",
  "StyleResources": "<ResourceDictionary xmlns=\"http://schemas.microsoft.com/winfx/2006/xaml/presentation\" xmlns:x=\"http://schemas.microsoft.com/winfx/2006/xaml\" xmlns:fx=\"clr-namespace:CategoryBar.Theming;assembly=CategoryBar\">\n<ControlTemplate x:Key=\"Theme.WorkspaceTemplate\" TargetType=\"fx:ThemeSurface\">\n<Grid><Grid.RowDefinitions><RowDefinition Height=\"Auto\"/><RowDefinition/></Grid.RowDefinitions>\n<ContentControl Style=\"{DynamicResource Theme.Sidebar}\" Margin=\"12,0,12,10\" Content=\"{TemplateBinding Header}\"/>\n<ContentControl Grid.Row=\"1\" Style=\"{DynamicResource Theme.Page}\" Content=\"{TemplateBinding Content}\"/>\n</Grid></ControlTemplate>\n<Style x:Key=\"Theme.NavigationPanel\" TargetType=\"StackPanel\"><Setter Property=\"Orientation\" Value=\"Horizontal\"/><Setter Property=\"Tag\" Value=\"{DynamicResource Theme.Parameter.navigation}\"/><Setter Property=\"Margin\" Value=\"8,6\"/><Style.Triggers><Trigger Property=\"Tag\" Value=\"left\"><Setter Property=\"Orientation\" Value=\"Vertical\"/></Trigger></Style.Triggers></Style>\n<Storyboard x:Key=\"Theme.Window.Enter\" FillBehavior=\"Stop\">\n<DoubleAnimation Storyboard.TargetProperty=\"Opacity\" From=\"0\" To=\"1\" Duration=\"0:0:0.26\"/>\n<DoubleAnimation Storyboard.TargetProperty=\"(UIElement.RenderTransform).(TranslateTransform.Y)\" From=\"16\" To=\"0\" Duration=\"0:0:0.26\"><DoubleAnimation.EasingFunction><BackEase EasingMode=\"EaseOut\" Amplitude=\"0.25\"/></DoubleAnimation.EasingFunction></DoubleAnimation>\n</Storyboard>\n<Storyboard x:Key=\"Theme.Page.Enter\" FillBehavior=\"Stop\">\n<DoubleAnimation Storyboard.TargetProperty=\"Opacity\" From=\"0\" To=\"1\" Duration=\"0:0:0.26\"/>\n<DoubleAnimation Storyboard.TargetProperty=\"(UIElement.RenderTransform).(TranslateTransform.X)\" From=\"16\" To=\"0\" Duration=\"0:0:0.26\"><DoubleAnimation.EasingFunction><BackEase EasingMode=\"EaseOut\" Amplitude=\"0.25\"/></DoubleAnimation.EasingFunction></DoubleAnimation>\n</Storyboard>\n<Storyboard x:Key=\"Theme.Tab.Enter\" FillBehavior=\"Stop\">\n<DoubleAnimation Storyboard.TargetProperty=\"Opacity\" From=\"0\" To=\"1\" Duration=\"0:0:0.26\"/>\n<DoubleAnimation Storyboard.TargetProperty=\"(UIElement.RenderTransform).(TranslateTransform.Y)\" From=\"16\" To=\"0\" Duration=\"0:0:0.26\"><DoubleAnimation.EasingFunction><BackEase EasingMode=\"EaseOut\" Amplitude=\"0.25\"/></DoubleAnimation.EasingFunction></DoubleAnimation>\n</Storyboard>\n<Storyboard x:Key=\"Theme.Menu.Enter\" FillBehavior=\"Stop\">\n<DoubleAnimation Storyboard.TargetProperty=\"Opacity\" From=\"0\" To=\"1\" Duration=\"0:0:0.26\"/>\n<DoubleAnimation Storyboard.TargetProperty=\"(UIElement.RenderTransform).(TranslateTransform.Y)\" From=\"16\" To=\"0\" Duration=\"0:0:0.26\"><DoubleAnimation.EasingFunction><BackEase EasingMode=\"EaseOut\" Amplitude=\"0.25\"/></DoubleAnimation.EasingFunction></DoubleAnimation>\n</Storyboard>\n<Storyboard x:Key=\"Theme.Bar.Enter\" FillBehavior=\"Stop\">\n<DoubleAnimation Storyboard.TargetProperty=\"Opacity\" From=\"0\" To=\"1\" Duration=\"0:0:0.26\"/>\n<DoubleAnimation Storyboard.TargetProperty=\"(UIElement.RenderTransform).(TranslateTransform.Y)\" From=\"16\" To=\"0\" Duration=\"0:0:0.26\"><DoubleAnimation.EasingFunction><BackEase EasingMode=\"EaseOut\" Amplitude=\"0.25\"/></DoubleAnimation.EasingFunction></DoubleAnimation>\n</Storyboard>\n<Storyboard x:Key=\"Theme.Toast.Enter\" FillBehavior=\"Stop\">\n<DoubleAnimation Storyboard.TargetProperty=\"Opacity\" From=\"0\" To=\"1\" Duration=\"0:0:0.26\"/>\n<DoubleAnimation Storyboard.TargetProperty=\"(UIElement.RenderTransform).(TranslateTransform.Y)\" From=\"16\" To=\"0\" Duration=\"0:0:0.26\"><DoubleAnimation.EasingFunction><BackEase EasingMode=\"EaseOut\" Amplitude=\"0.25\"/></DoubleAnimation.EasingFunction></DoubleAnimation>\n</Storyboard>\n<Storyboard x:Key=\"Theme.Content.Enter\" FillBehavior=\"Stop\">\n<DoubleAnimation Storyboard.TargetProperty=\"Opacity\" From=\"0\" To=\"1\" Duration=\"0:0:0.26\"/>\n<DoubleAnimation Storyboard.TargetProperty=\"(UIElement.RenderTransform).(TranslateTransform.Y)\" From=\"16\" To=\"0\" Duration=\"0:0:0.26\"><DoubleAnimation.EasingFunction><BackEase EasingMode=\"EaseOut\" Amplitude=\"0.25\"/></DoubleAnimation.EasingFunction></DoubleAnimation>\n</Storyboard>\n<Storyboard x:Key=\"Theme.Menu.Exit\" FillBehavior=\"HoldEnd\"><DoubleAnimation Storyboard.TargetProperty=\"Opacity\" To=\"0\" Duration=\"0:0:0.10\"/><DoubleAnimation Storyboard.TargetProperty=\"(UIElement.RenderTransform).(TranslateTransform.Y)\" To=\"4\" Duration=\"0:0:0.10\"/></Storyboard>\n<Storyboard x:Key=\"Theme.Menu.Switch\" FillBehavior=\"Stop\"><DoubleAnimation Storyboard.TargetProperty=\"Opacity\" From=\"0.35\" To=\"1\" Duration=\"0:0:0.14\"/></Storyboard>\n<ControlTemplate x:Key=\"Expressive.SidebarWorkspace\" TargetType=\"fx:ThemeSurface\"><Grid><Grid.ColumnDefinitions><ColumnDefinition Width=\"208\"/><ColumnDefinition/></Grid.ColumnDefinitions>\n<ContentControl Style=\"{DynamicResource Theme.Sidebar}\" Margin=\"12,0,8,12\" Content=\"{TemplateBinding Header}\"/>\n<ContentControl Grid.Column=\"1\" Style=\"{DynamicResource Theme.Page}\" Content=\"{TemplateBinding Content}\"/>\n</Grid></ControlTemplate>\n<Style x:Key=\"Theme.Workspace\" TargetType=\"fx:ThemeSurface\"><Setter Property=\"Template\" Value=\"{DynamicResource Theme.WorkspaceTemplate}\"/><Setter Property=\"Tag\" Value=\"{DynamicResource Theme.Parameter.navigation}\"/>\n<Style.Triggers><Trigger Property=\"Tag\" Value=\"left\"><Setter Property=\"Template\" Value=\"{DynamicResource Expressive.SidebarWorkspace}\"/></Trigger></Style.Triggers></Style>\n</ResourceDictionary>\n",
  "StyleResourcesFile": "",
  "Shaders": {},
  "ShaderFiles": {},
  "Dark": {
    "Bar.Bg": "#302A3D",
    "Menu.Bg": "#292334",
    "Popup.Bg": "#362D43",
    "Window.Bg": "#1D1825",
    "Sidebar.Bg": "#251F30",
    "Card.Bg": "#30283C",
    "Control.Bg": "#3D334C",
    "Text": "#F2EAFB",
    "Text.Muted": "#C8BDD6",
    "Text.Faint": "#B5A7C7",
    "Surface.Border": "#62566F",
    "Accent": "#D2B8FF"
  },
  "Light": {
    "Bar.Bg": "#EDE3FC",
    "Menu.Bg": "#F4EDFC",
    "Popup.Bg": "#FFFBFF",
    "Window.Bg": "#F7F2FC",
    "Sidebar.Bg": "#EDE4F5",
    "Card.Bg": "#EEE5F8",
    "Control.Bg": "#FFFBFF",
    "Text": "#261C34",
    "Text.Muted": "#5D4D6D",
    "Text.Faint": "#6E5D7E",
    "Surface.Border": "#BDAFCC",
    "Accent": "#7140AE"
  },
  "Backdrop": "None",
  "Parameters": [
    {
      "Id": "navigation",
      "Label": "Розташування навігації",
      "Type": "Choice",
      "Default": "top",
      "Options": {
        "top": "Згори",
        "left": "Ліворуч"
      }
    }
  ]
}
