{
  "Version": 1,
  "Id": "fluent",
  "Name": "Fluent",
  "Author": "",
  "Description": "Спокійні поверхні й знайомий стиль Windows.",
  "Material": "Solid",
  "FontName": "Segoe UI Variable Text",
  "CornerRadius": 10,
  "SurfaceOpacity": 0.96,
  "BorderWidth": 1,
  "StyleSheet": "/* Quiet, borderless Fluent surfaces with restrained elevation. */\n.theme { skin: studio; }\n.bar { height: 40px; padding: 4px; gap: 3px; border-radius: 10px; border-width: 0px; }\n.tab { height: 32px; padding: 0px 14px; margin: 0px; border-radius: 8px; border-width: 0px; font-size: 13px; font-weight: semibold; indicator: underline; selected-background: accent-soft; }\n.menu { width: 282px; padding: 10px; gap: 2px; border-radius: 14px; border-width: 0px; box-shadow: 0px 6px 24px rgba(0,0,0,0.2); }\n.menu-item { height: 38px; padding: 0px 12px; margin: 0px; border-radius: 8px; border-width: 0px; icon-size: 22px; }\n.button { min-height: 34px; padding: 5px 14px; border-radius: 8px; border-width: 0px; font-size: 13px; font-weight: semibold; }\n.input { min-height: 34px; padding: 5px 12px; border-radius: 8px; border-width: 0px; }\n.card { padding: 18px 20px; gap: 8px; border-radius: 12px; border-width: 0px; box-shadow: 0px 1px 4px rgba(0,0,0,0.06); }\n.sidebar-item { height: 38px; padding: 0px 14px; margin: 2px 0px; border-radius: 8px; }\n.window { border-radius: 8px; border-width: 1px; }\n.titlebar { height: 40px; border-width: 0px; }\n.sidebar { border-radius: 0px; border-width: 0px; }\n.page { background: transparent; border-width: 0px; }\n.toast { border-radius: 12px; border-width: 1px; }\n",
  "StyleSheetFile": "",
  "StyleResources": "<ResourceDictionary xmlns=\"http://schemas.microsoft.com/winfx/2006/xaml/presentation\" xmlns:x=\"http://schemas.microsoft.com/winfx/2006/xaml\" xmlns:fx=\"clr-namespace:CategoryBar.Theming;assembly=CategoryBar\">\n<ControlTemplate x:Key=\"Theme.WorkspaceTemplate\" TargetType=\"fx:ThemeSurface\">\n<Grid><Grid.ColumnDefinitions><ColumnDefinition Width=\"Auto\"/><ColumnDefinition/></Grid.ColumnDefinitions>\n<ContentControl Width=\"{DynamicResource Theme.Parameter.navigation-width}\" Style=\"{DynamicResource Theme.Sidebar}\" Margin=\"0\" Content=\"{TemplateBinding Header}\"/>\n<ContentControl Grid.Column=\"1\" Style=\"{DynamicResource Theme.Page}\" Content=\"{TemplateBinding Content}\"/>\n</Grid></ControlTemplate>\n<Style x:Key=\"Theme.NavigationPanel\" TargetType=\"StackPanel\"><Setter Property=\"Orientation\" Value=\"Vertical\"/><Setter Property=\"Margin\" Value=\"10,6,10,10\"/></Style>\n<Storyboard x:Key=\"Theme.Window.Enter\" FillBehavior=\"Stop\">\n<DoubleAnimation Storyboard.TargetProperty=\"Opacity\" From=\"0\" To=\"1\" Duration=\"0:0:0.16\"/>\n<DoubleAnimation Storyboard.TargetProperty=\"(UIElement.RenderTransform).(TranslateTransform.Y)\" From=\"4\" To=\"0\" Duration=\"0:0:0.16\"><DoubleAnimation.EasingFunction><CubicEase EasingMode=\"EaseOut\"/></DoubleAnimation.EasingFunction></DoubleAnimation>\n</Storyboard>\n<Storyboard x:Key=\"Theme.Page.Enter\" FillBehavior=\"Stop\">\n<DoubleAnimation Storyboard.TargetProperty=\"Opacity\" From=\"0\" To=\"1\" Duration=\"0:0:0.16\"/>\n<DoubleAnimation Storyboard.TargetProperty=\"(UIElement.RenderTransform).(TranslateTransform.Y)\" From=\"4\" To=\"0\" Duration=\"0:0:0.16\"><DoubleAnimation.EasingFunction><CubicEase EasingMode=\"EaseOut\"/></DoubleAnimation.EasingFunction></DoubleAnimation>\n</Storyboard>\n<Storyboard x:Key=\"Theme.Tab.Enter\" FillBehavior=\"Stop\">\n<DoubleAnimation Storyboard.TargetProperty=\"Opacity\" From=\"0\" To=\"1\" Duration=\"0:0:0.16\"/>\n<DoubleAnimation Storyboard.TargetProperty=\"(UIElement.RenderTransform).(TranslateTransform.Y)\" From=\"4\" To=\"0\" Duration=\"0:0:0.16\"><DoubleAnimation.EasingFunction><CubicEase EasingMode=\"EaseOut\"/></DoubleAnimation.EasingFunction></DoubleAnimation>\n</Storyboard>\n<Storyboard x:Key=\"Theme.Menu.Enter\" FillBehavior=\"Stop\">\n<DoubleAnimation Storyboard.TargetProperty=\"Opacity\" From=\"0\" To=\"1\" Duration=\"0:0:0.16\"/>\n<DoubleAnimation Storyboard.TargetProperty=\"(UIElement.RenderTransform).(TranslateTransform.Y)\" From=\"4\" To=\"0\" Duration=\"0:0:0.16\"><DoubleAnimation.EasingFunction><CubicEase EasingMode=\"EaseOut\"/></DoubleAnimation.EasingFunction></DoubleAnimation>\n</Storyboard>\n<Storyboard x:Key=\"Theme.Bar.Enter\" FillBehavior=\"Stop\">\n<DoubleAnimation Storyboard.TargetProperty=\"Opacity\" From=\"0\" To=\"1\" Duration=\"0:0:0.16\"/>\n<DoubleAnimation Storyboard.TargetProperty=\"(UIElement.RenderTransform).(TranslateTransform.Y)\" From=\"4\" To=\"0\" Duration=\"0:0:0.16\"><DoubleAnimation.EasingFunction><CubicEase EasingMode=\"EaseOut\"/></DoubleAnimation.EasingFunction></DoubleAnimation>\n</Storyboard>\n<Storyboard x:Key=\"Theme.Toast.Enter\" FillBehavior=\"Stop\">\n<DoubleAnimation Storyboard.TargetProperty=\"Opacity\" From=\"0\" To=\"1\" Duration=\"0:0:0.16\"/>\n<DoubleAnimation Storyboard.TargetProperty=\"(UIElement.RenderTransform).(TranslateTransform.Y)\" From=\"4\" To=\"0\" Duration=\"0:0:0.16\"><DoubleAnimation.EasingFunction><CubicEase EasingMode=\"EaseOut\"/></DoubleAnimation.EasingFunction></DoubleAnimation>\n</Storyboard>\n<Storyboard x:Key=\"Theme.Content.Enter\" FillBehavior=\"Stop\">\n<DoubleAnimation Storyboard.TargetProperty=\"Opacity\" From=\"0\" To=\"1\" Duration=\"0:0:0.16\"/>\n<DoubleAnimation Storyboard.TargetProperty=\"(UIElement.RenderTransform).(TranslateTransform.Y)\" From=\"4\" To=\"0\" Duration=\"0:0:0.16\"><DoubleAnimation.EasingFunction><CubicEase EasingMode=\"EaseOut\"/></DoubleAnimation.EasingFunction></DoubleAnimation>\n</Storyboard>\n<Storyboard x:Key=\"Theme.Menu.Exit\" FillBehavior=\"HoldEnd\"><DoubleAnimation Storyboard.TargetProperty=\"Opacity\" To=\"0\" Duration=\"0:0:0.10\"/><DoubleAnimation Storyboard.TargetProperty=\"(UIElement.RenderTransform).(TranslateTransform.Y)\" To=\"4\" Duration=\"0:0:0.10\"/></Storyboard>\n<Storyboard x:Key=\"Theme.Menu.Switch\" FillBehavior=\"Stop\"><DoubleAnimation Storyboard.TargetProperty=\"Opacity\" From=\"0.35\" To=\"1\" Duration=\"0:0:0.14\"/></Storyboard>\n</ResourceDictionary>\n",
  "StyleResourcesFile": "",
  "Shaders": {},
  "ShaderFiles": {},
  "Dark": {
    "Bar.Bg": "#26262C",
    "Menu.Bg": "#24242A",
    "Popup.Bg": "#2C2C32",
    "Window.Bg": "#1B1B1E",
    "Sidebar.Bg": "#202024",
    "Card.Bg": "#26262B",
    "Control.Bg": "#2E2E34",
    "Text": "#ECECEF",
    "Text.Muted": "#A6A6B0",
    "Text.Faint": "#9797A2",
    "Surface.Border": "#414148",
    "Accent": "#8EA8FF"
  },
  "Light": {
    "Bar.Bg": "#F4F4F7",
    "Menu.Bg": "#FAFAFC",
    "Popup.Bg": "#FFFFFF",
    "Window.Bg": "#F3F3F5",
    "Sidebar.Bg": "#E9E9EE",
    "Card.Bg": "#FFFFFF",
    "Control.Bg": "#FFFFFF",
    "Text": "#1C1C1F",
    "Text.Muted": "#55555E",
    "Text.Faint": "#686872",
    "Surface.Border": "#D1D1D9",
    "Accent": "#365EC9"
  },
  "Backdrop": "None",
  "Parameters": [
    {
      "Id": "navigation-width",
      "Label": "Ширина навігації",
      "Type": "Number",
      "Default": "208",
      "Minimum": 160,
      "Maximum": 280,
      "Step": 8
    }
  ]
}
